<?xml version="1.0" encoding="UTF-8"?>
<myDataBase xmlns="http://jd03_02.POJO.rudzko.it.by/"
            xmlns:ok="http://www.w3.org/2001/XMLSchema-instance"
            ok:schemaLocation="http://jd03_02.POJO.rudzko.it.by/ schema.xsd">
    <Roles>
        <Role>
            <ID>1</ID>
            <Participant>Администратор</Participant>
        </Role>
        <Role>
            <ID>2</ID>
            <Participant>Подписчик</Participant>
        </Role>
    </Roles>
    <Users>
        <User>
            <ID>1</ID>
            <Name>Иван</Name>
            <Role>
                <ID>1</ID>
                <Participant>Администратор</Participant>
            </Role>
            <BirthYear>1990</BirthYear>
             <Sex>M</Sex>
        </User>
        <User>
            <ID>2</ID>
            <Name>Марья</Name>
            <Role>
                <ID>2</ID>
                <Participant>Подписчик</Participant>
            </Role>
            <BirthYear>1995</BirthYear>
            <Sex>F</Sex>
        </User>
        <User>
            <ID>3</ID>
            <Name>Руслан</Name>
            <Role>
                <ID>2</ID>
                <Participant>Подписчик</Participant>
            </Role>
            <BirthYear>1985</BirthYear>
            <Sex>M</Sex>
        </User>
        <User>
            <ID>4</ID>
            <Name>Людмила</Name>
            <Role>
                <ID>2</ID>
                <Participant>Подписчик</Participant>
            </Role>
            <BirthYear>1990</BirthYear>
            <Sex>F</Sex>
        </User>
    </Users>
    <Readership>
        <Audience>
            <ID>1</ID>
            <Group>Adults</Group>
        </Audience>
        <Audience>
            <ID>2</ID>
            <Group>Men</Group>
        </Audience>
        <Audience>
            <ID>3</ID>
            <Group>Women</Group>
        </Audience>
        <Audience>
            <ID>4</ID>
            <Group>Teens</Group>
        </Audience>
        <Audience>
            <ID>5</ID>
            <Group>Children</Group>
        </Audience>
    </Readership>
    <Periodicals>
        <Periodical>
            <ID>1</ID>
            <Title>Дзеяслоў</Title>
            <SubIndex>74813</SubIndex>
            <Audience>
                <ID>1</ID>
                <Group>Adults</Group>
            </Audience>
            <AddedBy>
                <ID>1</ID>
                <Name>Иван</Name>
                <Role>
                    <ID>1</ID>
                    <Participant>Администратор</Participant>
                </Role>
                <BirthYear>1990</BirthYear>
                <Sex>M</Sex>
            </AddedBy>
        </Periodical>
        <Periodical>
            <ID>2</ID>
            <Title>Маладосць</Title>
            <SubIndex>74957</SubIndex>
            <Audience>
                <ID>4</ID>
                <Group>Teens</Group>
            </Audience>
            <AddedBy>
                <ID>1</ID>
                <Name>Иван</Name>
                <Role>
                    <ID>1</ID>
                    <Participant>Администратор</Participant>
                </Role>
                <BirthYear>1990</BirthYear>
                <Sex>M</Sex>
            </AddedBy>
        </Periodical>
        <Periodical>
            <ID>3</ID>
            <Title>Алеся</Title>
            <SubIndex>74995</SubIndex>
            <Audience>
                <ID>3</ID>
                <Group>Women</Group>
            </Audience>
            <AddedBy>
                <ID>1</ID>
                <Name>Иван</Name>
                <Role>
                    <ID>1</ID>
                    <Participant>Администратор</Participant>
                </Role>
                <BirthYear>1990</BirthYear>
                <Sex>M</Sex>
            </AddedBy>
        </Periodical>
        <Periodical>
            <ID>4</ID>
            <Title>Планета</Title>
            <SubIndex>75036</SubIndex>
            <Audience>
                <ID>1</ID>
                <Group>Adults</Group>
            </Audience>
            <AddedBy>
                <ID>1</ID>
                <Name>Иван</Name>
                <Role>
                    <ID>1</ID>
                    <Participant>Администратор</Participant>
                </Role>
                <BirthYear>1990</BirthYear>
                <Sex>M</Sex>
            </AddedBy>
        </Periodical>
        <Periodical>
            <ID>5</ID>
            <Title>Женский Журнал</Title>
            <SubIndex>74810</SubIndex>
            <Audience>
                <ID>3</ID>
                <Group>Women</Group>
            </Audience>
            <AddedBy>
                <ID>1</ID>
                <Name>Иван</Name>
                <Role>
                    <ID>1</ID>
                    <Participant>Администратор</Participant>
                </Role>
                <BirthYear>1990</BirthYear>
                <Sex>M</Sex>
            </AddedBy>
        </Periodical>
        <Periodical>
            <ID>6</ID>
            <Title>Наша Ніва</Title>
            <SubIndex>63125</SubIndex>
            <Audience>
                <ID>1</ID>
                <Group>Adults</Group>
            </Audience>
            <AddedBy>
                <ID>1</ID>
                <Name>Иван</Name>
                <Role>
                    <ID>1</ID>
                    <Participant>Администратор</Participant>
                </Role>
                <BirthYear>1990</BirthYear>
                <Sex>M</Sex>
            </AddedBy>
        </Periodical>
        <Periodical>
            <ID>7</ID>
            <Title>Культура</Title>
            <SubIndex>63875</SubIndex>
            <Audience>
                <ID>1</ID>
                <Group>Adults</Group>
            </Audience>
            <AddedBy>
                <ID>1</ID>
                <Name>Иван</Name>
                <Role>
                    <ID>1</ID>
                    <Participant>Администратор</Participant>
                </Role>
                <BirthYear>1990</BirthYear>
                <Sex>M</Sex>
            </AddedBy>
        </Periodical>
        <Periodical>
            <ID>8</ID>
            <Title>Минский курьер</Title>
            <SubIndex>63395</SubIndex>
            <Audience>
                <ID>1</ID>
                <Group>Adults</Group>
            </Audience>
            <AddedBy>
                <ID>1</ID>
                <Name>Иван</Name>
                <Role>
                    <ID>1</ID>
                    <Participant>Администратор</Participant>
                </Role>
                <BirthYear>1990</BirthYear>
                <Sex>M</Sex>
            </AddedBy>
        </Periodical>
        <Periodical>
            <ID>9</ID>
            <Title>Беларусь Сегодня</Title>
            <SubIndex>63889</SubIndex>
            <Audience><ID>1</ID>
                <Group>Adults</Group></Audience>
            <AddedBy>
                <ID>1</ID>
                <Name>Иван</Name>
                <Role>
                    <ID>1</ID>
                    <Participant>Администратор</Participant>
                </Role>
                <BirthYear>1990</BirthYear>
                <Sex>M</Sex>
            </AddedBy>
        </Periodical>
        <Periodical>
            <ID>10</ID>
            <Title>Прессбол</Title>
            <SubIndex>63115</SubIndex>
            <Audience>
                <ID>2</ID>
                <Group>Men</Group>
            </Audience>
            <AddedBy>
                <ID>1</ID>
                <Name>Иван</Name>
                <Role>
                    <ID>1</ID>
                    <Participant>Администратор</Participant>
                </Role>
                <BirthYear>1990</BirthYear>
                <Sex>M</Sex>
            </AddedBy>
        </Periodical>
    </Periodicals>
    <Subscription>
        <Subscr>
            <ID>1</ID>
            <Periodical>
                <ID>8</ID>
                <Title>Минский курьер</Title>
                <SubIndex>63395</SubIndex>
                <Audience>
                    <ID>1</ID>
                    <Group>Adults</Group>
                </Audience>
                <AddedBy>
                    <ID>1</ID>
                    <Name>Иван</Name>
                    <Role>
                        <ID>1</ID>
                        <Participant>Администратор</Participant>
                    </Role>
                    <BirthYear>1990</BirthYear>
                    <Sex>M</Sex>
                </AddedBy>
            </Periodical>
            <Subscriber>
                <ID>3</ID>
                <Name>Руслан</Name>
                <Role>
                    <ID>2</ID>
                    <Participant>Подписчик</Participant>
                </Role>
                <BirthYear>1985</BirthYear>
                <Sex>M</Sex>
            </Subscriber>
        </Subscr>
        <Subscr>
            <ID>2</ID>
            <Periodical>
                <ID>10</ID>
                <Title>Прессбол</Title>
                <SubIndex>63115</SubIndex>
                <Audience>
                    <ID>2</ID>
                    <Group>Men</Group>
                </Audience>
                <AddedBy>
                    <ID>1</ID>
                    <Name>Иван</Name>
                    <Role>
                        <ID>1</ID>
                        <Participant>Администратор</Participant>
                    </Role>
                    <BirthYear>1990</BirthYear>
                    <Sex>M</Sex>
                </AddedBy>
            </Periodical>
            <Subscriber>
                <ID>4</ID>
                <Name>Людмила</Name>
                <Role>
                    <ID>2</ID>
                    <Participant>Подписчик</Participant>
                </Role>
                <BirthYear>1990</BirthYear>
                <Sex>F</Sex>
            </Subscriber>
        </Subscr>
        <Subscr>
            <ID>3</ID>
            <Periodical>
                <ID>4</ID>